{
  "rewrite_summary": "无需修订，直接采用draft初稿。",
  "doc_type": "请示",
  "direction": "上行文",
  "style_level": 1,
  "risk_level": "high",
  "final_markdown": "# 关于申请项目专项预算支持的请示\n\n集团：\n\n目前，该项目已完成前期筹备。为保障后续推广工作有序推进，现就专项预算支持事项请示如下。\n\n一、请示缘由\n\n根据项目推进安排，目前相关前期筹备工作已完成，后续推广工作需进一步加强经费保障。\n\n二、必要性与依据\n\n从当前推进情况看，后续推广环节仍需要专项预算支持。由于素材未提供具体预算金额和项目正式名称，本文仅作概括性表述，不列示具体金额。\n\n三、请示事项\n\n拟请集团给予该项目专项预算支持，为后续推广工作提供经费保障。\n\n妥否，请批示。\n\n【落款单位待确认】\n\n【日期待确认】",
  "revision_report": [],
  "fact_usage_report": [
    {
      "final_text": "该项目已完成前期筹备",
      "fact_type": "achievement",
      "fact_value": "项目已完成前期筹备",
      "source_text": "目前项目已完成前期筹备",
      "source": "extract_result.fact_items",
      "confidence": 0.95
    },
    {
      "final_text": "后续推广工作需进一步加强经费保障",
      "fact_type": "problem",
      "fact_value": "后续推广需要专项预算支持",
      "source_text": "后续推广需要专项预算支持",
      "source": "extract_result.fact_items",
      "confidence": 0.94
    },
    {
      "final_text": "拟请集团给予该项目专项预算支持",
      "fact_type": "request",
      "fact_value": "请求集团给予专项预算支持",
      "source_text": "请求集团给予专项预算支持",
      "source": "extract_result.fact_items",
      "confidence": 0.96
    }
  ],
  "terminology_usage_report": [
    {
      "raw_value": "集团",
      "used_value": "集团",
      "type": "organization",
      "source": "user_input",
      "confidence": 0.65,
      "needs_manual_confirmation": true,
      "note": "正式主送单位需结合口径库或人工确认。"
    }
  ],
  "resolved_issues": [],
  "unresolved_issues": [],
  "remaining_risks": [
    {
      "level": "critical",
      "type": "doc_type_conflict",
      "detail": "用户指定为报告，但系统识别为请示。最终文种需人工确认。",
      "action": "建议确认最终文种；如保留预算支持请求，应按请示处理。"
    },
    {
      "level": "high",
      "type": "missing_field",
      "detail": "预算金额缺失，正文未写具体金额。",
      "action": "如正式报送，建议补充预算金额。"
    },
    {
      "level": "high",
      "type": "missing_field",
      "detail": "主送单位仅写'集团'，需确认正式全称。",
      "action": "正式成稿前需确认主送单位全称。"
    },
    {
      "level": "medium",
      "type": "missing_field",
      "detail": "项目正式名称缺失，正文使用'该项目'概括表述。",
      "action": "正式成稿前需确认项目正式名称。"
    },
    {
      "level": "medium",
      "type": "placeholder_used",
      "detail": "正文包含【落款单位待确认】和【日期待确认】占位符。",
      "action": "正式成稿前需补充落款单位和日期。"
    }
  ],
  "manual_confirmation_fields": [
    {
      "field": "最终文种",
      "reason": "用户指定报告，但系统识别为请示",
      "impact": "影响全文结构和结尾表达",
      "required_before_final": true
    },
    {
      "field": "预算金额",
      "reason": "用户请求预算支持但未提供金额",
      "impact": "影响请示事项明确性",
      "required_before_final": false
    },
    {
      "field": "主送单位全称",
      "reason": "用户仅写'集团'",
      "impact": "影响公文抬头",
      "required_before_final": true
    },
    {
      "field": "项目正式名称",
      "reason": "标题和正文需要",
      "impact": "影响准确性",
      "required_before_final": true
    },
    {
      "field": "落款单位",
      "reason": "请示必须有落款",
      "impact": "影响公文完整性",
      "required_before_final": true
    }
  ],
  "final_checks": {
    "doc_type_fixed": true,
    "unsupported_facts_removed": true,
    "blocked_items_removed": true,
    "terminology_checked": true,
    "manual_confirmations_preserved": true
  },
  "rewrite_policy": {
    "body_rewritten": true,
    "no_new_facts": true,
    "use_only_extract_facts": true,
    "no_rag_call": true,
    "follow_review_instructions": true,
    "follow_doc_type_rules": true,
    "follow_org_title_dictionary": true
  }
}